### ISSUE TITLE
[NEW] Gestion d'un incident impactant le serveur VPN

### ISSUE THREAD

**Issue by kevbarns** [mission-apprentissage/labonnealternance#3875]
**Jira:** [LBA-3310](https://tableaudebord-apprentissage.atlassian.net/browse/LBA-3310)
**Type:** Story
**Reporter (Jira):** @m-a-t-h-i-e-u
**Sprint Jira:** Sprint 15
**Terminé le:** 2025-11-06

---

## 🎯 Origine du besoin / Impact visé

Le service OpenVPN n'était plus disponible à partir du 2025-11-05 à 21h04, en raison d’un redémarrage automatique du serveur.

[LBA-3310]: https://tableaudebord-apprentissage.atlassian.net/browse/LBA-3310?atlOrigin=eyJpIjoiNWRkNTljNzYxNjVmNDY3MDlhMDU5Y2ZhYzA5YTRkZjUiLCJwIjoiZ2l0aHViLWNvbS1KU1cifQ

**Comment by kevbarns** [comment]
> **@m-a-t-h-i-e-u** — 2025-11-06 16:04

```
■ dig +noall +answer @dns1.alwaysdata.com http://labonnealternance.apprentissage.beta.gouv.fr 
http://labonnealternance.apprentissage.beta.gouv.fr . 1800 IN A 149.202.54.205

■ nc -nvzw 1 149.202.54.205 443
Connection to 149.202.54.205 443 port [tcp/*] succeeded!

■ doas rcctl -f restart openvpn
doas (hwnd@x) password:
openvpn(ok)
openvpn(ok)

■ ifconfig tun0
tun0: flags=8051<UP,POINTOPOINT,RUNNING,MULTICAST> mtu 1500
  index 14 priority 0 llprio 3
  groups: tun
  status: active
  inet 10.8.0.22 --> 10.8.0.1 netmask 0xffffff00

■ route -n show -inet | grep tun | grep 149.202.54.205
149.202.54.205/32  10.8.0.1           UGS        0        0     -     8 tun0

■ nc -nvzw 1 149.202.54.205 443
nc: connect to 149.202.54.205 port 443 (tcp) failed: Operation timed out

root@vpn-production:~# tcpdump -i tun0 -nvvv host 10.8.0.22 and host 149.202.54.205 2>/dev/null
14:44:33.212714 IP (tos 0x0, ttl 64, id 17297, offset 0, flags [DF], proto TCP (6), length 64)
    10.8.0.22.15717 > 149.202.54.205.443: Flags [S], cksum 0x0a3c (correct), seq 1011358754, win 16384, options [mss 1336,nop,nop,sackOK,nop,wscale 6,nop,nop,TS val  2802636526 ecr 0], length 0

root@vpn-production:~# tcpdump -i any -nvvv host 10.8.0.22 and host 149.202.54.205 2>/dev/null
14:44:56.165913 tun0  In  IP (tos 0x0, ttl 64, id 39114, offset 0, flags [DF], proto TCP (6), length 64)
    10.8.0.22.12856 > 149.202.54.205.443: Flags [S], cksum 0xa651 (correct), seq 3349035560, win 16384, options [mss 1336,nop,nop,sackOK,nop,wscale 6,nop,nop,TS val  2652415389 ecr 0], length 0
14:44:56.165987 wan   Out IP (tos 0x0, ttl 63, id 39114, offset 0, flags [DF], proto TCP (6), length 64)
    10.8.0.22.12856 > 149.202.54.205.443: Flags [S], cksum 0xa651 (correct), seq 3349035560, win 16384, options [mss 1336,nop,nop,sackOK,nop,wscale 6,nop,nop,TS val  2652415389 ecr 0], length 0

root@vpn-production:~# uptime
 14:40:55 up 17:36,  2 users,  load average: 0.01, 0.03, 0.00

root@vpn-production:~# ip -br l show wan
wan              UP             fa:16:3e:84:97:0e <BROADCAST,MULTICAST,UP,LOWER_UP>

root@vpn-production:~# cat /opt/app/scripts/iptables.sh
sh /etc/openvpn/iptables.sh "ens3" "udp" "1194"

root@vpn-production:~# cat /opt/app/scripts/iptables.sh
sh /etc/openvpn/iptables.sh "wan" "udp" "1194"

root@vpn-production:~# /opt/app/scripts/iptables.sh

■ nc -nvzw 1 149.202.54.205 443
Connection to 149.202.54.205 443 port [tcp/*] succeeded!
```


C'était donc un effet de bord de mes essais de la branche `sandbox` du dépôt `infra`. Ce déploiement ayant renommé l'interface réseau publique en `wan`.
